{
  "schema_version": "1.0",
  "pack": {
    "slug": "ouinpo-pack-demo",
    "title": "Pack de démonstration OuInPo",
    "description": "Pack de démonstration contenant une compétence, un exercice, des flashcards et un sujet pratique original. Aucun contenu élève, aucune clé API, aucun dump SQL.",
    "author": "OuInPo",
    "license": "CC BY-NC-SA 4.0",
    "created_at": "2026-05-01"
  },
  "school_levels": [],
  "difficulties": [],
  "competencies": [
    {
      "slug": "demo-nsi-premiere-algorithmique-parcours-tableau",
      "track": "NSI",
      "level": "Première",
      "cycle": "premiere",
      "domain": "Algorithmique",
      "domain_slug": "algorithmique",
      "competency": "Parcourir un tableau pour calculer ou rechercher une valeur.",
      "capacity": "Écrire un algorithme de parcours simple utilisant une variable d’accumulation ou de mémorisation.",
      "example": "Recherche du maximum dans un tableau non vide.",
      "reference_url": "",
      "active": 1
    },
    {
      "slug": "demo-nsi-terminale-pratique-programmer-tester",
      "track": "NSI",
      "level": "Terminale",
      "cycle": "terminale",
      "domain": "Algorithmique",
      "domain_slug": "algorithmique",
      "competency": "Écrire, tester et corriger un programme répondant à une spécification.",
      "capacity": "Décomposer un problème simple, écrire une fonction et proposer des tests pertinents.",
      "example": "Sujet pratique de type bac avec appels successifs.",
      "reference_url": "",
      "active": 1
    }
  ],
  "exercises": [
    {
      "title": "Le plus grand grimoire de la pile",
      "slug": "demo-plus-grand-grimoire-tableau",
      "level_slug": "premiere",
      "difficulty_slug": "debutant",
      "statement": "<p>Dans une bibliothèque légèrement inquiétante, chaque grimoire possède un nombre de pages.</p><p>Écris une fonction <code>maximum(tab)</code> qui prend en paramètre un tableau non vide d’entiers et renvoie la plus grande valeur du tableau.</p><p>Exemple : <code>maximum([12, 4, 27, 9])</code> doit renvoyer <code>27</code>.</p>",
      "is_active": 1,
      "competency_slugs": [
        "demo-nsi-premiere-algorithmique-parcours-tableau"
      ],
      "hints": [
        {
          "order": 1,
          "content": "<p>Commence par supposer que le premier élément du tableau est le maximum.</p>"
        },
        {
          "order": 2,
          "content": "<p>Parcours ensuite les valeurs du tableau une par une.</p>"
        },
        {
          "order": 3,
          "content": "<p>Si une valeur est plus grande que le maximum actuel, remplace le maximum actuel.</p>"
        }
      ],
      "solutions": [
        {
          "order": 1,
          "title": "Solution possible",
          "content": "<pre><code>def maximum(tab):\n    maxi = tab[0]\n    for valeur in tab:\n        if valeur > maxi:\n            maxi = valeur\n    return maxi</code></pre>",
          "is_official": 1
        }
      ],
      "exam_meta": {
        "exam_type": "written",
        "source_type": "type_bac",
        "session_label": "",
        "year_label": "",
        "center_label": "",
        "theme_bac": "algorithmique",
        "bac_format": "ecriture_complete",
        "estimated_minutes": 8,
        "is_exam_like": 1,
        "subject_group": "demo",
        "sort_in_subject": 1
      }
    },
    {
      "title": "Sujet pratique — La somme des nombres pairs",
      "slug": "demo-sujet-pratique-somme-pairs",
      "level_slug": "terminale",
      "difficulty_slug": "confirme",
      "statement": "<p>On dispose d’une liste d’entiers. Le but est d’écrire une fonction qui calcule la somme des valeurs paires.</p>",
      "is_active": 1,
      "competency_slugs": [
        "demo-nsi-terminale-pratique-programmer-tester"
      ],
      "hints": [],
      "solutions": [],
      "exam_meta": {
        "exam_type": "practical_subject",
        "source_type": "type_bac",
        "session_label": "",
        "year_label": "",
        "center_label": "",
        "theme_bac": "algorithmique",
        "bac_format": "ecriture_complete",
        "estimated_minutes": 50,
        "is_exam_like": 1,
        "subject_group": "demo-pratique",
        "sort_in_subject": 1
      },
      "practical_calls": [
        {
          "call_order": 1,
          "title": "Écrire la fonction",
          "prompt_html": "<p>Écris une fonction <code>somme_pairs(tab)</code> qui renvoie la somme des entiers pairs présents dans le tableau <code>tab</code>.</p>",
          "ai_rubric": "La fonction doit parcourir le tableau, tester la parité avec modulo 2, accumuler les valeurs paires et renvoyer la somme.",
          "answer_mode": "code",
          "max_points": 10,
          "is_active": 1
        },
        {
          "call_order": 2,
          "title": "Tester la fonction",
          "prompt_html": "<p>Propose au moins trois tests pertinents, dont un tableau sans nombre pair.</p>",
          "ai_rubric": "Les tests doivent couvrir un cas standard, un cas sans pair et un cas avec zéro ou des nombres négatifs.",
          "answer_mode": "mixed",
          "max_points": 5,
          "is_active": 1
        }
      ],
      "practical_files": [
        {
          "label": "Sujet de démonstration",
          "file_url": "",
          "file_kind": "subject",
          "file_order": 1,
          "practical_call_order": null
        }
      ]
    }
  ],
  "flashcards": [
    {
      "deck": {
        "title": "NSI Première — Algorithmique — Démo",
        "slug": "demo-nsi-premiere-algorithmique",
        "description": "Cartes de démonstration sur le parcours de tableau en Première NSI.",
        "track": "NSI",
        "level": "Première",
        "is_active": 1
      },
      "cards": [
        {
          "card_type": "definition",
          "front_html": "<p>Qu’est-ce qu’un parcours de tableau ?</p>",
          "back_html": "<p>C’est le fait de visiter les éléments d’un tableau les uns après les autres, souvent avec une boucle.</p>",
          "note_teacher": "",
          "sort_order": 1,
          "is_active": 1,
          "competency_slugs": [
            "demo-nsi-premiere-algorithmique-parcours-tableau"
          ]
        },
        {
          "card_type": "repere",
          "front_html": "<p>Quelle valeur initialise-t-on souvent pour chercher un maximum dans un tableau non vide ?</p>",
          "back_html": "<p>On initialise souvent le maximum avec le premier élément du tableau, par exemple <code>maxi = tab[0]</code>.</p>",
          "note_teacher": "",
          "sort_order": 2,
          "is_active": 1,
          "competency_slugs": [
            "demo-nsi-premiere-algorithmique-parcours-tableau"
          ]
        }
      ]
    }
  ],
  "badges": []
}