{
  "schema_version": "1.0",
  "pack": {
    "slug": "ouinpo-pack-test-flashcards",
    "title": "Pack de test flashcards",
    "description": "Pack de test pour vérifier l'import de flashcards.",
    "author": "OuInPo",
    "license": "Contenu de test non destiné à la diffusion",
    "created_at": "2026-05-01"
  },
  "school_levels": [],
  "difficulties": [],
  "competencies": [
    {
      "slug": "nsi-premiere-algorithmique-test-002",
      "track": "NSI",
      "level": "Première",
      "cycle": "premiere",
      "domain": "Algorithmique",
      "domain_slug": "algorithmique",
      "competency": "Parcourir un tableau pour calculer une valeur.",
      "capacity": "Écrire un algorithme de parcours simple.",
      "example": "Recherche du maximum dans un tableau d'entiers.",
      "reference_url": "",
      "active": 1
    }
  ],
  "exercises": [],
  "flashcards": [
    {
      "deck": {
        "title": "NSI Première — Algorithmique",
        "slug": "nsi-premiere-algorithmique-test",
        "description": "Cartes de test sur l’algorithmique en Première NSI.",
        "track": "NSI",
        "level": "Première",
        "is_active": 1
      },
      "cards": [
        {
          "card_type": "definition",
          "front_html": "<p>Qu’est-ce qu’un parcours de tableau ?</p>",
          "back_html": "<p>C’est le fait de visiter les éléments d’un tableau les uns après les autres, souvent avec une boucle.</p>",
          "note_teacher": "",
          "sort_order": 1,
          "is_active": 1,
          "competency_slugs": [
            "nsi-premiere-algorithmique-test-002"
          ]
        },
        {
          "card_type": "repere",
          "front_html": "<p>Quelle valeur initialise-t-on souvent pour chercher un maximum dans un tableau non vide ?</p>",
          "back_html": "<p>On initialise souvent le maximum avec le premier élément du tableau, par exemple <code>maxi = tab[0]</code>.</p>",
          "note_teacher": "",
          "sort_order": 2,
          "is_active": 1,
          "competency_slugs": [
            "nsi-premiere-algorithmique-test-002"
          ]
        }
      ]
    }
  ],
  "badges": []
}