{
  "schema_version": "1.0",
  "pack": {
    "slug": "ouinpo-pack-test-minimal",
    "title": "Pack de test minimal",
    "description": "Pack de test pour vérifier l'import des niveaux, difficultés et compétences.",
    "author": "OuInPo",
    "license": "Contenu de test non destiné à la diffusion",
    "created_at": "2026-05-01"
  },
  "school_levels": [
    {
      "slug": "seconde",
      "label": "Seconde"
    },
    {
      "slug": "premiere",
      "label": "Première"
    },
    {
      "slug": "terminale",
      "label": "Terminale"
    }
  ],
  "difficulties": [
    {
      "slug": "debutant",
      "label": "Débutant"
    },
    {
      "slug": "confirme",
      "label": "Confirmé"
    },
    {
      "slug": "expert",
      "label": "Expert"
    }
  ],
  "competencies": [
    {
      "slug": "nsi-premiere-algorithmique-test-001",
      "track": "NSI",
      "level": "Première",
      "cycle": "premiere",
      "domain": "Algorithmique",
      "domain_slug": "algorithmique",
      "competency": "Écrire, mettre au point et exécuter un programme.",
      "capacity": "Comprendre et mettre en œuvre un algorithme simple.",
      "example": "Recherche dans un tableau.",
      "reference_url": "",
      "active": 1
    }
  ],
  "exercises": [],
  "flashcards": [],
  "badges": []
}