{
  "schema_version": "1.0",
  "pack": {
    "slug": "pack-exercice-reimport",
    "title": "Pack exercice reimport",
    "description": "Fixture technique: pack stable pour verifier qu'un reimport ne cree pas de doublons.",
    "author": "OuInPo",
    "license": "Contenu de test non destine a la diffusion",
    "created_at": "2026-05-17"
  },
  "school_levels": [
    {
      "slug": "premiere",
      "label": "Premiere"
    }
  ],
  "difficulties": [
    {
      "slug": "confirme",
      "label": "Confirme"
    }
  ],
  "competencies": [
    {
      "slug": "fixture-reimport-algorithmique-001",
      "track": "NSI",
      "level": "Premiere",
      "cycle": "premiere",
      "domain": "Algorithmique",
      "domain_slug": "algorithmique",
      "competency": "Ecrire et tester une fonction simple.",
      "capacity": "Utiliser une boucle et une condition.",
      "example": "Compter les occurrences d'une valeur.",
      "reference_url": "",
      "active": 1
    }
  ],
  "exercises": [
    {
      "title": "Compter les occurrences",
      "slug": "fixture-reimport-compter-occurrences",
      "level_slug": "premiere",
      "difficulty_slug": "confirme",
      "statement": "<p>Ecrire une fonction <code>compte(tab, valeur)</code> qui renvoie le nombre d'occurrences de <code>valeur</code>.</p>",
      "is_active": 1,
      "competency_slugs": [
        "fixture-reimport-algorithmique-001"
      ],
      "hints": [
        {
          "order": 1,
          "content": "<p>Initialiser un compteur a 0.</p>"
        }
      ],
      "solutions": [
        {
          "order": 1,
          "title": "Solution de reference",
          "content": "<pre><code>def compte(tab, valeur):\n    total = 0\n    for item in tab:\n        if item == valeur:\n            total += 1\n    return total</code></pre>",
          "is_official": 1
        }
      ],
      "exam_meta": {
        "exam_type": "written",
        "source_type": "fixture",
        "session_label": "Fixture reimport",
        "year_label": "2026",
        "center_label": "",
        "theme_bac": "algorithmique",
        "bac_format": "ecriture_complete",
        "estimated_minutes": 8,
        "is_exam_like": 0,
        "subject_group": "reimport",
        "sort_in_subject": 1
      }
    }
  ],
  "flashcards": [],
  "badges": []
}
